  ,Maintenance Item,Point Value,Interval,Jan,Feb,Mar,Apr,May,Jun,Jul,Aug,Sep,Oct,Nov,Dec,Mobility Priority,Weather Trigger,Newsfeed Section,Summary Feature 1,Feature 1 Image Link,Summary Feature 2,Feature 2 Image Link,Summary Feature 3,Feature 3 Image Link,Small Bungalow,Large Bungalow,Small Condo,Large Condo,Small 2-Story,Large 2-Story,Larger Home,Small Yard,Medium Yard,Large Yard,Gardens,Hedges,A few trees,Lots of trees,No Driveway,2-Car Driveway,4-Car Driveway,6-Car Driveway,8-Car Driveway,10-Car Driveway,Deck,Porch,Balcony,Walkway,Fireplace,Pool,No Mobility Issues,Mild Issues,Some difficulty,Severe difficulty,Wheel chair,,Tool 1,Tool 2,Tool 3,Tool 4,Tool 5,Material 1,Material 2,Material 3,Material 4,Material 5,Maintenance Summary,Learn Video 1 Title,Learn Video Link 1,Learn Video 2 Title,Learn Video Link 2,Learn Video 3 Title,Learn Video Link 3,Cautions
,Remind to change sensitive internet passwords,10,Biannually,,,,,,,,,,,,,,,Prevent This Month,When was the last time you changed your most used internet passwords?,,,,,,,,,,,,,,,,,,,,,,,,,,,,,,,,,,,,,,,,,,,,,,,,If you still use passwords on websites you need to consider changing them 2-3 times a year so that you are secure.  It's best to use new ones each time.  Custodia will remind you and help you if you need help.  ,Should you regularly change your internet passwords?,https://www.youtube.com/watch?v=kJVrV2HT-s4,,,,,
,Remove shower heads and clean sediment,10,Annually,,,,,,,,,,,,,,,Clean This Month,"Is hard water clogging your shower head?  it's tricky, but we can fix that!",,,,,,,,,,,,,,,,,,,,,,,,,,,,,,,,,,,,,,Pipe Pliers,,,,,Baking soda,Vinegar,,,,Custodia will help the water flow free!  We will clean your shower head and have it working perfectly or we will replace it. ,How to remove sediment from the shower head,https://www.youtube.com/watch?v=K14b2DyEz3c,,,,,
,Run water and flush toilets in unused spaces,10,Biannually,,,,,,,,,,,,,,,Prevent This Month,Quickly run the water to release any air bubbles that may be in the pipes,,,,,,,,,,,,,,,,,,,,,,,,,,,,,,,,,,,,,,,,,,,Hand Towel,,,,,Getting into these unused spaces helps Custodia ensure they are maintained and operating efficiently.,How to maintain and clean a bathroom tap,https://www.youtube.com/watch?v=RrZYhr0DjWk,,,,,The water in the pipes could get old and stale.
,Service and lubricate doors/hinges/locks/deadbolts,10,Annually,,,,,,,,,,,,,,,Inside This Month,Loose screws and parts will lead to failure faster,,,,,,,,,,,,,,,,,,,,,,,,,,,,,,,,,,,,,,Drill,Utility knife,,,,Wood for stripped screw holes,Common door hardware screws,Work Cloth,,,"Just pick up a screwdriver and walk around to all your window and door locks.  Jiggle them, if they are loose, tighten them.","How to maintain and install locks, deadbolts and hinges",https://www.youtube.com/watch?v=LVSt3BtHeaI,,,,,Newer locks may not fit well in older door handle holes in doors.  Make sure you know the size of the hole and the size of the new lock set
,Sweep and mop front walkway / hallway,6,Weekly,,,,,,,,,,,,,,,Clean This Month,A nice sweep and mop makes things look nicer and smell great,,,,,,,,,,,,,,,,,,,,,,,,,,,,,,,,,,,,,,Broom and Dustpan,Wet Mop,Bucket,,,All purpose cleaner,dust bag,Face Mask (depending),,,"Each time we visit, we will finish up buy sweeping and mopping the front walkway / hallway.  A quick task that really finishes things up nicely.",How to properly sweep and mop,https://www.youtube.com/watch?v=BN3JKgrY1I0,,,,,
,Test / Clean and Maintain Sump Pump,10,Annually,,,,,,,,,,,,,,,Inside This Month,"Sump Pumps keep the water outside, where it belongs",,,,,,,,,,,,,,,,,,,,,,,,,,,,,,,,,,,,,,Screwdriver set,Pipe Pliers,,,,Pool Chlorine,,,,,"If you have a sump pump in the home and have never touched it, it's best to test and clean it so it's functioning optimally.",How to test and maintain a sump pump,https://www.youtube.com/watch?v=WjcZyJxr8fg,,,,,
,Test garage door and it's auto-reverse feature,10,Annually,,,,,,,,,,,,,,,Outside This Month,Testing the garage door is simple and could save you thousands in damages,,,,,,,,,,,,,,,,,,,,,,,,,,,,,,,,,,,,,,Screwdriver Set,,,,,WD 40 Lubrication,,,,,It's easy to kick one of the garage door sensors and to misalign them.  You want to take care to ensure your auto reverse feature is working flawlessly.  Custodia will test and tighten twice a year to ensure that all is working properly.,How to maintain your garage door opener and test the garage door opener auto reverse feature.,https://www.youtube.com/watch?v=FTzA7oXy8fM,,,,,Inspect weather stip at bottom of door.
,Test smoke/CO detectors/security system,10,Bimonthly,,,,,,,,,,,,,,,,How often to you change batteries and test these systems?,,,,,,,,,,,,,,,,,,,,,,,,,,,,,,,,,,,,,,Screwdriver Kit,,,,,Compressed Air,AA Batteries,Dust Cloth,,,Your battery or electricity powered home protection systems need to be tested and maintained every few months.  We do our best to test them each time we visit.  It does not take too long. ,How to test smoke detectors,https://www.youtube.com/watch?v=3Y4R6fWcteM,,,,,
,Test the gas fireplace,10,Annually,,,,,,,,,,,,,,,,"If you have a gas fireplace, a couple of maintenance checks a year should do it.",,,,,,,,,,,,,,,,,,,,,,,,,,,,,,,,,,,,,,Screwdriver Kit,,,,,Dusting Towel,Spray Cleaner,,,,"They make your home much more comfortable and visually appealing.  Custodia do not do extensive certified repairs on gas fireplaces, we leave that to the pros.  We help the owner maintain them, so they last longer.",How to do preventative maintenance on your gas fireplace,https://www.youtube.com/watch?v=beqquvhtPRE,,,,,
,Test your water heater pressure relief valve,10,Annually,,,,,,,,,,,,,,,,Testing the pressure valve will ensure your safety in the event of a malfunction,,,,,,,,,,,,,,,,,,,,,,,,,,,,,,,,,,,,,,Water Pressure Gauge,Small Bucket ,,,,Hand Towel,,,,,It's a simple test but a valuable one.  You don't want to have a water heater malfunction and have this valve out of service. ,How to test your temperature and pressure relief valve,https://www.youtube.com/watch?v=sMDTEjJUImw,,,,,"New one, no worries.  Old style, do not test it.  If you pop it, it may not reset.  They may still work, but a test might break them.  Be careful."
,Tighten screws in furniture ,10,Annually,,,,,,,,,,,,,,,,"If you have Ikea furniture, you need to tighten the screws!",,,,,,,,,,,,,,,,,,,,,,,,,,,,,,,,,,,,,,Screwdriver set,Ikea Furniture Repair Kit,,,,Dusting Towel,Spray Cleaner,,,,"It's a great product, but you need to keep it tight.  Screws and knobs that listen up are the first things to break and can destroy the stability of your furniture.  Custodia will check and tighten up where needed.",How to fix loose screws in Ikea furniture,https://www.youtube.com/watch?v=GpsHoKriKX8,,,,,
,Trim any loose threads on carpets and rugs,10,Biannually,,,,,,,,,,,,,,,Inside This Month,Do you have loose threads in rugs or carpets?,,,,,,,,,,,,,,,,,,,,,,,,,,,,,,,,,,,,,,Scissors,Pen,,,,Carpet glue,,,,,"Each visit, we check your rugs and carpets for loose threads or imperfections that need a trim.  We will lightly vacuum the carpet while we are there as well.",How to fix a carpet where the threads have been pulled out,https://www.youtube.com/watch?v=gBqjBgAbWDA,,,,,
,Turn off and shut down air conditioner for the season,10,Annually,,,,,,,,,,,,,,,,"Let's keep your air conditioner working longer, maintain it before winter",,,,,,,,,,,,,,,,,,,,,,,,,,,,,,,,,,,,,,Drill,AC Fin Straightener,Soft bristle brush,,,Compressed air,,,,,"You can simply let the snowfall on it or keep it sitting in your window.  Custodia recommends a light servicing and inspection two times a year.  These things are expensive, prevent issues before they happen.",How to maintain an AC unit,https://www.youtube.com/watch?v=SEVx7ByV9Rg,,,,,
,Turn On Exterior Attach detach Hoses,10,Annually,,,,,x,,,,,,,,,,,Before winter we turn off the exterior water and prepare for cold,,,,,,,,,,,,,,,,,,,,,,,,,,,,,,,,,,,,,,Pliers,,,,,Hand Towel,,,,,"Custodia will get your outside water supply, hoses and other tools put away for the winter.  Turning off the water outside will help lower the risk of a burst pipe as things freeze.","Turning on and off outside water, removing leftover water and bleeding lines",https://www.youtube.com/watch?v=A_FV753VCMg,,,,,
,Turn off Exterior Water detach Hoses,10,Annually,,,,,,,,,,,x,,,,,Before winter we turn off the exterior water and prepare for cold,,,,,,,,,,,,,,,,,,,,,,,,,,,,,,,,,,,,,,Pliers,,,,,Hand Towel,,,,,"Custodia will get your outside water supply, hoses and other tools put away for the winter.  Turning off the water outside will help lower the risk of a burst pipe as things freeze.","Turning on and off outside water, removing leftover water and bleeding lines",https://www.youtube.com/watch?v=A_FV753VCMg,,,,,
,Water Sprinkler Shutdown/Turn on,10,Annually,,,,,x,,,,,,,,,,,"If you have sprinklers, they should be shut down during the colder months,",,,,,,,,,,,,,,,,,,,,,,,,,,,,,,,,,,,,,,10 inch Pipe Pliers,Plyers,,,,Work Cloth,,,,,Custodia will schedule a shutdown and maintenance of your water sprinkler system.  Another simple checklist review to ensure everything is working correctly and ready for the season.,4 ways to turn off / on water sprinklers,https://www.youtube.com/watch?v=cQNaPiziel4,,,,,You need to make sure you have a way to blow the water out of the pipes to close it off for winter.  You detach the water and attach a air compressor to push the water out.
,Water Sprinkler Shutdown/Turn off,10,Annually,,,,,,,,,,,x,,,,,"If you have sprinklers, they should be shut down during the colder months,",,,,,,,,,,,,,,,,,,,,,,,,,,,,,,,,,,,,,,10 inch Pipe Pliers,Plyers,,,,Work Cloth,,,,,Custodia will schedule a shutdown and maintenance of your water sprinkler system.  Another simple checklist review to ensure everything is working correctly and ready for the season.,4 ways to turn off / on water sprinklers,https://www.youtube.com/watch?v=cQNaPiziel4,,,,,You need to make sure you have a way to blow the water out of the pipes to close it off for winter.  You detach the water and attach a air compressor to push the water out.
,Water the plants inside,10,Biweekly,x,x,x,x,x,x,x,x,x,x,x,x,,,Outside This month,Plants in the home give the room more life and feels better,,"Keep the plants healthy, they add so much to the home",,Are the plants around the house looking healthy?,,x,x,x,x,x,x,x,,,,,,,,,,,,,,,,,,,,,,,,,,Water Dispenser,,,,,Plant Food,,,,,"Water the plants in your home once every two weeks or so. In dryer homes, or for speacial plants you may need to water more often. Check out these popular videos that talk about how to water different types of plants in the home.",How to keep houseplants alive and thriving,https://www.youtube.com/watch?v=SDtWi0z13LQ,,,,,
,Water the plants outside,10,Weekly,,,,,,x,x,x,x,,,,,,Outside This month,Keep them alive and well and they will keep you happier,,Plants should be watered and within view so it can be enjoyed ,,Green plants and colourful flowers make the home a better place to live.,,x,x,,,,x,x,,,,,,,,,,,,,,,,,,,,,,,,,,Water Dispenser,Hose and Nozzel,,,,Plant Food,,,,,"If it's dry outside, you may need to water your plants and flowers more often to keep them alive and looking nice. These plants provide the home owner with more enjoyment and a sense of nature around the home. ",How to keep houseplants alive and thriving,https://www.youtube.com/watch?v=SDtWi0z13LQ,,,,,
